### ISSUE TITLE
Timeout when updating host

### ISSUE THREAD

**Issue by seriousp** [nsupdate-info/nsupdate.info#144]
Hi, I'm newbie on Github. I have problem when I try to add a new host on my domain and found message "Timeout - communicating to name server failed.". 

Then, I try to sniffer packet between nsupdate.info and my auth nameserver. An output as below,

13:03:28.596766 IP 85.10.192.104.22995 > 10.2.4.145.53: 11793% [1au] SOA? ooo.mypz.in.th. (43)
13:03:28.606175 IP 10.2.4.145.53 > 85.10.192.104.22995: 11793 NXDomain_\- 0/1/1 (94)
13:05:54.029521 IP 85.10.192.104.50202 > 10.2.4.145.53: 16633% [1au] SOA? bbb.mypz.in.th. (43)
13:05:54.031528 IP 10.2.4.145.53 > 85.10.192.104.50202: 16633 NXDomain_\- 0/1/1 (94)

nsupdate send packet to check this host(bbb.mypz.in.th) to my auth nameserver but don't send any update packet.

I try to update with nsupdate command on linux and I found a correct flow as below,

13:15:56.318991 IP 122.155.55.58.7654 > 10.2.4.145.53: 12093 [1au] SOA? demo.mypz.in.th. (148)
13:15:56.320380 IP 10.2.4.145.53 > 122.155.55.58.7654: 12093 NXDomain*- 0/1/1 (199)
13:15:56.371160 IP 122.155.55.58.7654 > 10.2.4.145.53: 8253 update [1n] [1au] SOA? mypz.in.th. (164)
13:15:56.432053 IP 10.2.4.145.53 > 122.155.55.58.7654: 8253 update- 0/0/1 (143)
13:15:56.434734 IP 10.2.4.145.53500 > 210.213.38.82.53: 52951 notify [b2&3=0x2400] [1a] SOA? mypz.in.th. (79)
13:15:58.437486 IP 10.2.4.145.53500 > 210.213.38.82.53: 12764 notify [b2&3=0x2400] [1a] SOA? mypz.in.th. (79)
13:16:00.439431 IP 10.2.4.145.53500 > 210.213.38.82.53: 21279 notify [b2&3=0x2400] [1a] SOA? mypz.in.th. (79)
13:16:02.441682 IP 10.2.4.145.53500 > 210.213.38.82.53: 6579 notify [b2&3=0x2400] [1a] SOA? mypz.in.th. (79)

Finally, Could you suggest me to solve this problem ? Many thanks for you and your dev.

Sorry, for my english
Best Regards,
